#dba_<prijmeni>.txt - textový soubor obsahující pøíkazy, které byly provedeny v rámci bodù 5-8 (vèetnì bonusu)
#5. Export daného schématu pomocí nástroje Expdp - export bude proveden bez dat v tabulkách

a) pridání práv a nastavení
	 sqlplus sys/Lenovo123@pamatest as sysdba
	 ALTER USER pavel5 IDENTIFIED BY pavel5 ACCOUNT UNLOCK;
	 CREATE OR REPLACE DIRECTORY dp_exp_dir AS 'C:\Users\pavelma\ora';
	 GRANT READ, WRITE ON DIRECTORY dp_exp_dir TO pavel5;
   exit

b) volání exportu
	 expdp pavel5/pavel5@pamatest schemas=pavel5 directory=dp_exp_dir CONTENT=metadata_only dumpfile=Expdp_pavel5_Majer.dmp logfile=Expdp_pavel5_Majer.log 

#6. Import exportovaného dump souboru z bodu 5 pomocí Impdp
		a) drop objektù pøed importem
		 drop table stul;
		 drop table katalog;
		 drop table objednavka;
		 drop sequence objednavka_seq;
		 drop sequence stul_seq;
		 drop sequence katalog_seq;
		 drop synonym obj;
		 drop view aktualni_objednavky;
		b) zavolani importu
		 impdp pavel5/pavel5@pamatest directory=dp_exp_dir dumpfile=Expdp_pavel5_Majer.dmp logfile=Impdp_pavel5_Majer.log 

		c) kontrola po importu
		  SQL> select * from katalog;
		  no rows selected
		d) naplnìní dat zpátky
		  insert into katalog (nazev,cena) values ('Svíèková' , 130 );
		  insert into katalog (nazev,cena) values ('Rajská' , 120 );
		  insert into katalog (nazev,cena) values ('Frankfurtská' , 105 );
		  select * from katalog;
		  
		  insert into stul (nazev) values ('Salonek 1'); 
		  insert into stul (nazev) values ('Salonek 2'); 
		  insert into stul (nazev) values ('Salonek 3'); 
		  insert into stul (nazev) values ('Bar 1'); 
		  insert into stul (nazev) values ('Bar 2'); 
		  select * from stul;
		  
		  select * from objednavka;
		  insert into objednavka (stul, polozka) values (1,1);
		  insert into objednavka (stul, polozka) values (1,2);
		  insert into objednavka (stul, polozka) values (2,2);
		  insert into objednavka (stul, polozka) values (3,3);
		  insert into objednavka (stul, polozka) values (3,2);
		  commit;


#7. Záloha databáze - Backup (pomocí nástroje RMAN)
   7a)soucet v polozek v objednavkach - pro kontrolu
      C:\Users\pavelma\ora>sqlplus pavel5/pavel5@pamatest
      SQL> select * from objednavka;
   7b)priprava na cold backup  
      C:\Users\pavelma\ora> sqlplus sys/Lenovo123@pamatest as sysdba
		  SQL> select name from v$datafile;	
	 7c) zastaveni db
	    SQL> shutdown immediate
	  	SQL> startup mount;
	  	SQL> exit
	 7e) rman	
      set ORACLE_SID=pamatest
    	C:\Users\pavelma\ora>rman target /
  7f) zavolat backup
      backup database;
	7g) soubor existuje
   	C:\Users\pavelma\Documents\oradata\pamatest\backup\05SOUBTL_1_1 
  7h) open db
			  C:\Users\pavelma\ora>sqlplus / as sysdba
				SQL> alter database open;
  7i) znicit data
        C:\Users\pavelma\ora>sqlplus pavel5/pavel5@pamatest
				SQL> update katalog set cena = 0;
				SQL> commit
				SQL>  select * from katalog;
				SQL> exit
  7j) zastavit DB, a zamaskovat BAR_05.DBF (prejmenovat na BAR_05XXXXX.DBFXXX)
		C:\Users\pavelma\ora>sqlplus / as sysdba
    shutdown immediate
  7k) pokus o start db
     C:\Users\pavelma\ora>sqlplus / as sysdba
     SQL> startup mount;
   
 
#8. Obnova databáze - Restore (pomocí nástroje RMAN)
  8a) rman - pokus o restore souboru
     RMAN> connect target /
      RMAN> restore datafile 'C:\USERS\PAVELMA\DOCUMENTS\ORADATA\PAMATEST\BAR_05.DBF';
   8b) start db
      RMAN> alter database open;
   8c) pripojeni do db -- recovery s posledni zmenou po backupu (takze neslo o cold recovery)
	    SQL>  select * from katalog;
		  SQL> select * from katalog;
   8d) start
  		SQL> shutdown immediate
			SQL> startup nomount
	 8e) restore z backupu
		  C:\Users\pavelma\ora>rman target /
			RMAN> restore controlfile from 'C:\ORACLE\BACKUP\FLASH_RECOVERY_AREA\PAMATEST\AUTOBACKUP\2018_01_17\O1_MF_S_965683646_F5ZG3NCO_.BKP';
		  RMAN> alter database mount;
			RMAN> restore database;
			RMAN> alter database open resetlogs;
     	SQL> select * from katalog;

#9. Export a Import celé databáze pomocí nástroje Exp a Imp (starší zpùsob)
 a) export
   exp pavel5/pavel5@pamatest GRANTS=y CONSTRAINTS=y owner=pavel5 file=Exp_pavel5_Majer.dmp log=Exp_pavel5_Majer.log 
 b) cistka
   drop table stul;
   drop table katalog;
   drop table objednavka;
 c) import 
  imp pavel5/pavel5@pamatest ignore=Y file=Exp_pavel5_Majer.dmp log=Imp_pavel5_Majer.log 




LOG DOLE
----------------------------------------------------------------------------
- KROK 5 - EXPDP
----------------------------------------------------------------------------
 5a) prava na export
 ----------
			Copyright (c) 1982, 2016, Oracle.  All rights reserved.

			Connected to:
			Oracle Database 12c Enterprise Edition Release 12.2.0.1.0 - 64bit Production

			SQL> ALTER USER pavel5 IDENTIFIED BY pavel5 ACCOUNT UNLOCK;

			User altered.

			SQL> CREATE OR REPLACE DIRECTORY dp_exp_dir AS 'C:\Users\pavelma\ora';

			Directory created.

			SQL> GRANT READ, WRITE ON DIRECTORY dp_exp_dir TO pavel5;

			Grant succeeded.

			SQL> commit;

			Commit complete.

			SQL> exit


 5b) export
 ----------
			expdp pavel5/pavel5@pamatest schemas=pavel5 directory=dp_exp_dir CONTENT=metadata_only dumpfile=Expdp_pavel5_Majer.dmp logfile=Expdp_pavel5_Majer.log 
			Connected to: Oracle Database 12c Enterprise Edition Release 12.2.0.1.0 - 64bit Production
			Starting "PAVEL5"."SYS_EXPORT_SCHEMA_01":  pavel5/********@pamatest schemas=pavel5 directory=dp_exp_dir CONTENT=metadata_only dumpfile=Expdp_pavel5_Majer.dmp logfile=Expdp_pavel5_Majer.log
			Processing object type SCHEMA_EXPORT/TABLE/INDEX/STATISTICS/INDEX_STATISTICS
			Processing object type SCHEMA_EXPORT/TABLE/STATISTICS/TABLE_STATISTICS
			Processing object type SCHEMA_EXPORT/STATISTICS/MARKER
			Processing object type SCHEMA_EXPORT/PRE_SCHEMA/PROCACT_SCHEMA
			Processing object type SCHEMA_EXPORT/SYNONYM/SYNONYM
			Processing object type SCHEMA_EXPORT/SEQUENCE/SEQUENCE
			Processing object type SCHEMA_EXPORT/TABLE/TABLE
			Processing object type SCHEMA_EXPORT/TABLE/COMMENT
			Processing object type SCHEMA_EXPORT/VIEW/VIEW
			Processing object type SCHEMA_EXPORT/TABLE/INDEX/INDEX
			Processing object type SCHEMA_EXPORT/TABLE/CONSTRAINT/CONSTRAINT
			Processing object type SCHEMA_EXPORT/TABLE/TRIGGER
			Master table "PAVEL5"."SYS_EXPORT_SCHEMA_01" successfully loaded/unloaded
			******************************************************************************
			Dump file set for PAVEL5.SYS_EXPORT_SCHEMA_01 is:
			  C:\USERS\PAVELMA\ORA\EXPDP_PAVEL5_MAJER.DMP
			Job "PAVEL5"."SYS_EXPORT_SCHEMA_01" successfully completed at Wed Jan 17 16:55:44 2018 elapsed 0 00:01:03

----------------------------------------------------------------------------
- KROK 6 - IMPDP
----------------------------------------------------------------------------

  6a) drop tabulek po exportu
 ---------------------------
			C:\Users\pavelma\ora> sqlplus pavel5/pavel5@pamatest
			SQL*Plus: Release 12.2.0.1.0 Production on Wed Jan 17 16:57:11 2018
			Copyright (c) 1982, 2016, Oracle.  All rights reserved.
			Last Successful login time: Wed Jan 17 2018 16:54:37 +01:00

			Connected to:
			Oracle Database 12c Enterprise Edition Release 12.2.0.1.0 - 64bit Production

			SQL> prompt "drop tables" ;
			"drop tables"
			SQL> drop table stul;
			Table dropped.

			SQL> drop table katalog;
			Table dropped.

			SQL> drop table objednavka;
			Table dropped.

			SQL> drop sequence objednavka_seq;
			Sequence dropped.

			SQL> drop sequence stul_seq;
			Sequence dropped.

			SQL> drop sequence katalog_seq;
			Sequence dropped.

			SQL> drop synonym obj;
			Synonym dropped.

			SQL> drop view aktualni_objednavky;
			View dropped.

  6b) pak volani impdp
			impdp pavel5/pavel5@pamatest directory=dp_exp_dir dumpfile=Expdp_pavel5_Majer.dmp logfile=Impdp_pavel5_Majer.log 

			Disconnected from Oracle Database 12c Enterprise Edition Release 12.2.0.1.0 - 64bit Production

			C:\Users\pavelma\ora>impdp pavel5/pavel5@pamatest directory=dp_exp_dir dumpfile=Expdp_pavel5_Majer.dmp logfile=Impdp_pavel5_Majer.log

			Import: Release 12.2.0.1.0 - Production on Wed Jan 17 18:21:24 2018

			Copyright (c) 1982, 2017, Oracle and/or its affiliates.  All rights reserved.

			Connected to: Oracle Database 12c Enterprise Edition Release 12.2.0.1.0 - 64bit Production
			Master table "PAVEL5"."SYS_IMPORT_FULL_01" successfully loaded/unloaded
			Starting "PAVEL5"."SYS_IMPORT_FULL_01":  pavel5/********@pamatest directory=dp_exp_dir dumpfile=Expdp_pavel5_Majer.dmp logfile=Impdp_pavel5_Majer.log
			Processing object type SCHEMA_EXPORT/PRE_SCHEMA/PROCACT_SCHEMA
			Processing object type SCHEMA_EXPORT/SYNONYM/SYNONYM
			Processing object type SCHEMA_EXPORT/SEQUENCE/SEQUENCE
			Processing object type SCHEMA_EXPORT/TABLE/TABLE
			Processing object type SCHEMA_EXPORT/VIEW/VIEW
			Processing object type SCHEMA_EXPORT/TABLE/TRIGGER
			Processing object type SCHEMA_EXPORT/TABLE/STATISTICS/TABLE_STATISTICS
			Processing object type SCHEMA_EXPORT/STATISTICS/MARKER
			Job "PAVEL5"."SYS_IMPORT_FULL_01" successfully completed at Wed Jan 17 18:21:46 2018 elapsed 0 00:00:17

			C:\Users\pavelma\ora>

   6c) pak kontrola
			SQL> select * from katalog;
			no rows selected

----------------------------------------------------------------------------
- KROK 7 - BACKUP
----------------------------------------------------------------------------
  7a)soucet v polozek v objednavkach - pro kontrolu
      C:\Users\pavelma\ora>sqlplus pavel5/pavel5@pamatest
      SQL> select * from objednavka;
        ID VYTVORENO       STUL    POLOZKA
       --- --------- ---------- ----------
         6 17-JAN-18          1          1
         7 17-JAN-18          1          2
         8 17-JAN-18          2          2
         9 17-JAN-18          3          3
        10 17-JAN-18          3          2
       
    7b)priprava na cold backup  
    C:\Users\pavelma\ora> sqlplus sys/Lenovo123@pamatest as sysdba
		SQL> select name from v$datafile;	
		NAME
		--------------------------------------------------------------------------------
		C:\USERS\PAVELMA\DOCUMENTS\ORADATA\PAMATEST\SYSTEM01.DBF
		C:\USERS\PAVELMA\DOCUMENTS\ORADATA\PAMATEST\SYSAUX01.DBF
		C:\USERS\PAVELMA\DOCUMENTS\ORADATA\PAMATEST\UNDOTBS01.DBF
		C:\USERS\PAVELMA\DOCUMENTS\ORADATA\PAMATEST\USERS01.DBF
		C:\USERS\PAVELMA\DOCUMENTS\ORADATA\PAMATEST\WORKSHOP01.DBF
		C:\USERS\PAVELMA\DOCUMENTS\ORADATA\PAMATEST\ZOO_01.DBF
		C:\USERS\PAVELMA\DOCUMENTS\ORADATA\PAMATEST\BAR_01.DBF
		C:\USERS\PAVELMA\DOCUMENTS\ORADATA\PAMATEST\BAR_02.DBF
		C:\USERS\PAVELMA\DOCUMENTS\ORADATA\PAMATEST\BAR_03.DBF
		C:\USERS\PAVELMA\DOCUMENTS\ORADATA\PAMATEST\BAR_05.DBF
		
  7c) zastaveni db
	 SQL> shutdown immediate
		Database closed.
		Database dismounted.
		ORACLE instance shut down.
		ERROR:
		ORA-12514: TNS:listener does not currently know of service requested in connect
		descriptor

		Warning: You are no longer connected to ORACLE.
		SQL> startup mount;
		SP2-0640: Not connected
		SQL> exit

		
	7d) start
		C:\Users\pavelma\ora>sqlplus / as sysdba
		SQL*Plus: Release 12.2.0.1.0 Production on Wed Jan 17 21:29:32 2018
		Copyright (c) 1982, 2016, Oracle.  All rights reserved.
		Connected to an idle instance.

		SQL> startup mount;
		ORACLE instance started.

		Total System Global Area  964689920 bytes
		Fixed Size                  8753816 bytes
		Variable Size             369102184 bytes
		Database Buffers          578813952 bytes
		Redo Buffers                8019968 bytes
		Database mounted.
		SQL> exit
	
	 7e) rman	
    set ORACLE_SID=pamatest
   	C:\Users\pavelma\ora>rman target /
		Recovery Manager: Release 12.2.0.1.0 - Production on Wed Jan 17 21:52:15 2018
		Copyright (c) 1982, 2017, Oracle and/or its affiliates.  All rights reserved.
		connected to target database: PAMATEST (DBID=1916084427, not open)

  7f) zavolat backup
     backup database;
				Starting backup at 17-JAN-18
				using target database control file instead of recovery catalog
				allocated channel: ORA_DISK_1
				channel ORA_DISK_1: SID=11 device type=DISK
				channel ORA_DISK_1: starting full datafile backup set
				channel ORA_DISK_1: specifying datafile(s) in backup set
				input datafile file number=00001 name=C:\USERS\PAVELMA\DOCUMENTS\ORADATA\PAMATEST\SYSTEM01.DBF
				input datafile file number=00003 name=C:\USERS\PAVELMA\DOCUMENTS\ORADATA\PAMATEST\SYSAUX01.DBF
				input datafile file number=00005 name=C:\USERS\PAVELMA\DOCUMENTS\ORADATA\PAMATEST\UNDOTBS01.DBF
				input datafile file number=00008 name=C:\USERS\PAVELMA\DOCUMENTS\ORADATA\PAMATEST\WORKSHOP01.DBF
				input datafile file number=00009 name=C:\USERS\PAVELMA\DOCUMENTS\ORADATA\PAMATEST\ZOO_01.DBF
				input datafile file number=00010 name=C:\USERS\PAVELMA\DOCUMENTS\ORADATA\PAMATEST\BAR_01.DBF
				input datafile file number=00011 name=C:\USERS\PAVELMA\DOCUMENTS\ORADATA\PAMATEST\BAR_02.DBF
				input datafile file number=00012 name=C:\USERS\PAVELMA\DOCUMENTS\ORADATA\PAMATEST\BAR_03.DBF
				input datafile file number=00013 name=C:\USERS\PAVELMA\DOCUMENTS\ORADATA\PAMATEST\BAR_05.DBF
				input datafile file number=00007 name=C:\USERS\PAVELMA\DOCUMENTS\ORADATA\PAMATEST\USERS01.DBF
				channel ORA_DISK_1: starting piece 1 at 17-JAN-18
				channel ORA_DISK_1: finished piece 1 at 17-JAN-18
				piece handle=C:\USERS\PAVELMA\DOCUMENTS\ORADATA\PAMATEST\BACKUP\05SOUBTL_1_1 tag=TAG20180117T215252 comment=NONE
				channel ORA_DISK_1: backup set complete, elapsed time: 00:00:15
				Finished backup at 17-JAN-18

				Starting Control File and SPFILE Autobackup at 17-JAN-18
				piece handle=C:\ORACLE\BACKUP\FLASH_RECOVERY_AREA\PAMATEST\AUTOBACKUP\2018_01_17\O1_MF_S_965683646_F5ZFXOYJ_.BKP comment=NONE
				Finished Control File and SPFILE Autobackup at 17-JAN-18

     backup current controlfile;
				Starting backup at 17-JAN-18
				using channel ORA_DISK_1
				channel ORA_DISK_1: starting full datafile backup set
				channel ORA_DISK_1: specifying datafile(s) in backup set
				including current control file in backup set
				channel ORA_DISK_1: starting piece 1 at 17-JAN-18
				channel ORA_DISK_1: finished piece 1 at 17-JAN-18
				piece handle=C:\USERS\PAVELMA\DOCUMENTS\ORADATA\PAMATEST\BACKUP\07SOUC41_1_1 tag=TAG20180117T215617 comment=NONE
				channel ORA_DISK_1: backup set complete, elapsed time: 00:00:01
				Finished backup at 17-JAN-18

				Starting Control File and SPFILE Autobackup at 17-JAN-18
				piece handle=C:\ORACLE\BACKUP\FLASH_RECOVERY_AREA\PAMATEST\AUTOBACKUP\2018_01_17\O1_MF_S_965683646_F5ZG3NCO_.BKP comment=NONE
				Finished Control File and SPFILE Autobackup at 17-JAN-18

	7g) soubor existuje
   	C:\Users\pavelma\Documents\oradata\pamatest\backup\05SOUBTL_1_1 
 
  7h) open db
			  C:\Users\pavelma\ora>sqlplus / as sysdba
				SQL> alter database open;
				Database altered.

				SQL>  select group#, sequence#, status from v$log;
				    GROUP#  SEQUENCE# STATUS
				---------- ---------- ----------------
				         1         37 INACTIVE
				         2         38 CURRENT
				         3         36 INACTIVE

  7i) znicit data
     C:\Users\pavelma\ora>sqlplus pavel5/pavel5@pamatest
				 SQL> select * from katalog;

				        ID NAZEV                                CENA
				---------- ------------------------------ ----------
				         4 Sv!Yková                              130
				         5 Rajská                                120
				         6 Frankfurtská                          105

				SQL> update katalog set cena = 0;
				3 rows updated.
				SQL> commit
				Commit complete.

				SQL>  select * from katalog;

				        ID NAZEV                                CENA
				---------- ------------------------------ ----------
				         4 Sv!Yková                                0
				         5 Rajská                                  0
				         6 Frankfurtská                            0

				SQL> exit

  7j) zastavit DB, a zamaskovat BAR_05.DBF (prejmenovat na BAR_05XXXXX.DBFXXX)
		C:\Users\pavelma\ora>sqlplus / as sysdba
    shutdown immediate
    C:\USERS\PAVELMA\DOCUMENTS\ORADATA\PAMATEST\BAR_05.DBF

  7k) pokus o start db
     C:\Users\pavelma\ora>sqlplus / as sysdba
     SQL> startup mount;
			ORACLE instance started.

			Total System Global Area  964689920 bytes
			Fixed Size                  8753816 bytes
			Variable Size             369102184 bytes
			Database Buffers          578813952 bytes
			Redo Buffers                8019968 bytes
			Database mounted.
			SQL>  alter database open;
			 alter database open
			*
			ERROR at line 1:
			ORA-01157: cannot identify/lock data file 13 - see DBWR trace file
			ORA-01110: data file 13:
			'C:\USERS\PAVELMA\DOCUMENTS\ORADATA\PAMATEST\BAR_05.DBF'


----------------------------------------------------------------------------
- KROK 8 - RESTORE
----------------------------------------------------------------------------
Restore_<prijmeni>.log - výpis z restore souboru (je možné dodat screen .jpg) - bod 8
      
  8a) rman - pokus o restore souboru
			C:\Users\pavelma\ora>rman
			Recovery Manager: Release 12.2.0.1.0 - Production on Wed Jan 17 22:19:31 2018
			Copyright (c) 1982, 2017, Oracle and/or its affiliates.  All rights reserved.
			RMAN> connect target /
			connected to target database: PAMATEST (DBID=1916084427, not open)

			RMAN> restore datafile 'C:\USERS\PAVELMA\DOCUMENTS\ORADATA\PAMATEST\BAR_05.DBF';

			Starting restore at 17-JAN-18
			using channel ORA_DISK_1

			channel ORA_DISK_1: starting datafile backup set restore
			channel ORA_DISK_1: specifying datafile(s) to restore from backup set
			channel ORA_DISK_1: restoring datafile 00013 to C:\USERS\PAVELMA\DOCUMENTS\ORADATA\PAMATEST\BAR_05.DBF
			channel ORA_DISK_1: reading from backup piece C:\USERS\PAVELMA\DOCUMENTS\ORADATA\PAMATEST\BACKUP\05SOUBTL_1_1
			channel ORA_DISK_1: piece handle=C:\USERS\PAVELMA\DOCUMENTS\ORADATA\PAMATEST\BACKUP\05SOUBTL_1_1 tag=TAG20180117T215252
			channel ORA_DISK_1: restored backup piece 1
			channel ORA_DISK_1: restore complete, elapsed time: 00:00:02
			Finished restore at 17-JAN-18

			RMAN> recover datafile 'C:\USERS\PAVELMA\DOCUMENTS\ORADATA\PAMATEST\BAR_05.DBF';

			Starting recover at 17-JAN-18
			using channel ORA_DISK_1

			starting media recovery
			media recovery complete, elapsed time: 00:00:00

			Finished recover at 17-JAN-18

      >> soubor existuje: BAR_05.DBF

   8b) start db
   RMAN> alter database open;
   Statement processed
   RMAN>
		
	 8c) pripojeni do db -- recovery s posledni zmenou po backupu (takze neslo o cold recovery)
				SQL>  select * from katalog;
			 SQL> select * from katalog;

        ID NAZEV                                CENA
       --- ------------------------------ ----------
         4 Sv!Yková                                0
         5 Rajská                                  0
         6 Frankfurtská                            0
		
		8d) start
		SQL> shutdown immediate
			Database closed.
			Database dismounted.
			ORACLE instance shut down.
			SQL> startup nomount
			ORACLE instance started.

			Total System Global Area  964689920 bytes
			Fixed Size                  8753816 bytes
			Variable Size             369102184 bytes
			Database Buffers          578813952 bytes
			Redo Buffers                8019968 bytes
			SQL>
		
		8e) restore z backupu
		  C:\Users\pavelma\ora>rman target /
			Recovery Manager: Release 12.2.0.1.0 - Production on Wed Jan 17 22:49:46 2018
			Copyright (c) 1982, 2017, Oracle and/or its affiliates.  All rights reserved.
			connected to target database: PAMATEST (not mounted)
			RMAN> restore controlfile from 'C:\ORACLE\BACKUP\FLASH_RECOVERY_AREA\PAMATEST\AUTOBACKUP\2018_01_17\O1_MF_S_965683646_F5ZG3NCO_.BKP';

			Starting restore at 17-JAN-18
			using target database control file instead of recovery catalog
			allocated channel: ORA_DISK_1
			channel ORA_DISK_1: SID=260 device type=DISK

			channel ORA_DISK_1: restoring control file
			channel ORA_DISK_1: restore complete, elapsed time: 00:00:01
			output file name=C:\USERS\PAVELMA\DOCUMENTS\ORADATA\PAMATEST\CONTROL01.CTL
			output file name=C:\USERS\PAVELMA\DOCUMENTS\FAST_RECOVERY_AREA\PAMATEST\CONTROL02.CTL
			Finished restore at 17-JAN-18

			RMAN>
		  RMAN> alter database mount;

			Statement processed
			released channel: ORA_DISK_1

			RMAN> restore database;

			Starting restore at 17-JAN-18
			Starting implicit crosscheck backup at 17-JAN-18
			allocated channel: ORA_DISK_1
			channel ORA_DISK_1: SID=260 device type=DISK
			Crosschecked 7 objects
			Finished implicit crosscheck backup at 17-JAN-18

			Starting implicit crosscheck copy at 17-JAN-18
			using channel ORA_DISK_1
			Finished implicit crosscheck copy at 17-JAN-18

			searching for all files in the recovery area
			cataloging files...
			cataloging done

			List of Cataloged Files
			=======================
			File Name: C:\ORACLE\BACKUP\FLASH_RECOVERY_AREA\PAMATEST\AUTOBACKUP\2018_01_17\O1_MF_S_965683646_F5ZG3NCO_.BKP

			using channel ORA_DISK_1

			channel ORA_DISK_1: starting datafile backup set restore
			channel ORA_DISK_1: specifying datafile(s) to restore from backup set
			channel ORA_DISK_1: restoring datafile 00001 to C:\USERS\PAVELMA\DOCUMENTS\ORADATA\PAMATEST\SYSTEM01.DBF
			channel ORA_DISK_1: restoring datafile 00003 to C:\USERS\PAVELMA\DOCUMENTS\ORADATA\PAMATEST\SYSAUX01.DBF
			channel ORA_DISK_1: restoring datafile 00005 to C:\USERS\PAVELMA\DOCUMENTS\ORADATA\PAMATEST\UNDOTBS01.DBF
			channel ORA_DISK_1: restoring datafile 00007 to C:\USERS\PAVELMA\DOCUMENTS\ORADATA\PAMATEST\USERS01.DBF
			channel ORA_DISK_1: restoring datafile 00008 to C:\USERS\PAVELMA\DOCUMENTS\ORADATA\PAMATEST\WORKSHOP01.DBF
			channel ORA_DISK_1: restoring datafile 00009 to C:\USERS\PAVELMA\DOCUMENTS\ORADATA\PAMATEST\ZOO_01.DBF
			channel ORA_DISK_1: restoring datafile 00010 to C:\USERS\PAVELMA\DOCUMENTS\ORADATA\PAMATEST\BAR_01.DBF
			channel ORA_DISK_1: restoring datafile 00011 to C:\USERS\PAVELMA\DOCUMENTS\ORADATA\PAMATEST\BAR_02.DBF
			channel ORA_DISK_1: restoring datafile 00012 to C:\USERS\PAVELMA\DOCUMENTS\ORADATA\PAMATEST\BAR_03.DBF
			channel ORA_DISK_1: restoring datafile 00013 to C:\USERS\PAVELMA\DOCUMENTS\ORADATA\PAMATEST\BAR_05.DBF
			channel ORA_DISK_1: reading from backup piece C:\USERS\PAVELMA\DOCUMENTS\ORADATA\PAMATEST\BACKUP\05SOUBTL_1_1
			channel ORA_DISK_1: piece handle=C:\USERS\PAVELMA\DOCUMENTS\ORADATA\PAMATEST\BACKUP\05SOUBTL_1_1 tag=TAG20180117T215252
			channel ORA_DISK_1: restored backup piece 1
			channel ORA_DISK_1: restore complete, elapsed time: 00:00:25
			Finished restore at 17-JAN-18

			RMAN> alter database open;

			RMAN-00571: ===========================================================
			RMAN-00569: =============== ERROR MESSAGE STACK FOLLOWS ===============
			RMAN-00571: ===========================================================
			RMAN-03002: failure of sql statement command at 01/17/2018 22:55:26
			ORA-01589: must use RESETLOGS or NORESETLOGS option for database open

			RMAN> alter database open resetlogs;

			Statement processed

			RMAN>
		
		SQL> select * from katalog;
        ID NAZEV                                CENA
    ------ ------------------------------ ----------
         4 Sv!Yková                              130
         5 Rajská                                120
         6 Frankfurtská                          105
    
    >> uz nejsou videt ty puvodni nuly
		

----------------------------------------------------------------------------
- KROK 9 - BONUS
----------------------------------------------------------------------------
  9.a) EXPORT
  -----------
		C:\Users\pavelma\ora>exp pavel5/pavel5@pamatest GRANTS=y CONSTRAINTS=y owner=pavel5 file=Exp_DB_pamatest.dmp log=Exp_DB_pamatest.log

		Export: Release 12.2.0.1.0 - Production on Wed Jan 17 18:38:03 2018

		Copyright (c) 1982, 2017, Oracle and/or its affiliates.  All rights reserved.


		Connected to: Oracle Database 12c Enterprise Edition Release 12.2.0.1.0 - 64bit Production
		Export done in WE8MSWIN1252 character set and AL16UTF16 NCHAR character set
		server uses EE8MSWIN1250 character set (possible charset conversion)
		. exporting pre-schema procedural objects and actions
		. exporting foreign function library names for user PAVEL5
		. exporting PUBLIC type synonyms
		. exporting private type synonyms
		. exporting object type definitions for user PAVEL5
		About to export PAVEL5's objects ...
		. exporting database links
		. exporting sequence numbers
		. exporting cluster definitions
		. about to export PAVEL5's tables via Conventional Path ...
		. . exporting table                        KATALOG          3 rows exported
		. . exporting table                     OBJEDNAVKA          5 rows exported
		. . exporting table                           STUL          5 rows exported
		. exporting synonyms
		. exporting views
		. exporting stored procedures
		. exporting operators
		. exporting referential integrity constraints
		. exporting triggers
		. exporting indextypes
		. exporting bitmap, functional and extensible indexes
		. exporting posttables actions
		. exporting materialized views
		. exporting snapshot logs
		. exporting job queues
		. exporting refresh groups and children
		. exporting dimensions
		. exporting post-schema procedural objects and actions
		. exporting statistics
		Export terminated successfully without warnings.


  9b) cistka tabulek
  ------------------
		C:\Users\pavelma\ora> sqlplus pavel5/pavel5@pamatest

		SQL*Plus: Release 12.2.0.1.0 Production on Wed Jan 17 18:39:08 2018

		Copyright (c) 1982, 2016, Oracle.  All rights reserved.

		Last Successful login time: Wed Jan 17 2018 18:38:04 +01:00

		Connected to:
		Oracle Database 12c Enterprise Edition Release 12.2.0.1.0 - 64bit Production

		SQL> drop table stul;

		Table dropped.

		SQL>    drop table katalog;

		Table dropped.

		SQL>    drop table objednavka;

		Table dropped.

		SQL> exit
		Disconnected from Oracle Database 12c Enterprise Edition Release 12.2.0.1.0 - 64bit Production
 
  9c) IMPORT
  ----------
 		C:\Users\pavelma\ora>  imp pavel5/pavel5@pamatest ignore=Y file=Exp_DB_pamatest.dmp log=Exp_DB_pamatest.log

		Import: Release 12.2.0.1.0 - Production on Wed Jan 17 18:40:11 2018

		Copyright (c) 1982, 2017, Oracle and/or its affiliates.  All rights reserved.


		Connected to: Oracle Database 12c Enterprise Edition Release 12.2.0.1.0 - 64bit Production

		Export file created by EXPORT:V12.02.00 via conventional path
		import done in WE8MSWIN1252 character set and AL16UTF16 NCHAR character set
		import server uses EE8MSWIN1250 character set (possible charset conversion)
		. importing PAVEL5's objects into PAVEL5
		. . importing table                      "KATALOG"          3 rows imported
		. . importing table                   "OBJEDNAVKA"          5 rows imported
		. . importing table                         "STUL"          5 rows imported
		Import terminated successfully without warnings.

 
   9d) kontrola
   ------------
		C:\Users\pavelma\ora> sqlplus pavel5/pavel5@pamatest

		SQL*Plus: Release 12.2.0.1.0 Production on Wed Jan 17 18:40:21 2018

		Copyright (c) 1982, 2016, Oracle.  All rights reserved.

		Last Successful login time: Wed Jan 17 2018 18:40:12 +01:00

		Connected to:
		Oracle Database 12c Enterprise Edition Release 12.2.0.1.0 - 64bit Production

		SQL> select count (*) from katalog;

		  COUNT(*)
		----------
		         3
